{
  "schema_version": "1.0.0",
  "mode": "NON_CANONICAL_SHADOW",
  "authority": "CANONICAL_MARKDOWN_OWNS_SEMANTICS",
  "canonical_source": "docs/architecture/ORDEM_COMPRA_C3_TRACEABILITY.md",
  "requirements": [
    {
      "requirement_id": "OC-C3-READ-001",
      "normative_sources": [
        {
          "path": "docs/architecture/ORDEM_COMPRA_LIFECYCLE_SPEC_PROPOSED.md",
          "anchor": "§R.29.2"
        }
      ],
      "disposition": "PARTIALLY_SATISFIED",
      "evidence_pointers": [
        "db/75_ordem_compra_c3c_inactive_cutover.sql",
        "js/screens/ordem-compra-receipt-cutover.js",
        "js/screens/pedido-detail-data.js",
        "js/screens/op-nova.js",
        "js/screens/fornecedor.js",
        "tests/ordem-compra-c3c-inactive.smoke.js",
        "tests/ordem-compra-c3c-inactive.integration.sql",
        "tests/ordem-compra-receipt-cutover.smoke.js",
        "tests/pedido-detail.smoke.js",
        "tests/op-nova.smoke.js",
        "tests/fornecedor-screens.smoke.js"
      ],
      "phase_owner": "C3C-B",
      "blocking_state": "NON_BLOCKING",
      "source_location": "docs/architecture/ORDEM_COMPRA_C3_TRACEABILITY.md:82",
      "review_status": "REVIEWED"
    },
    {
      "requirement_id": "OC-C3-WRITE-001",
      "normative_sources": [
        {
          "path": "docs/architecture/ORDEM_COMPRA_LIFECYCLE_SPEC_PROPOSED.md",
          "anchor": "§R.29.1"
        },
        {
          "path": "docs/architecture/ORDEM_COMPRA_LIFECYCLE_SPEC_PROPOSED.md",
          "anchor": "§R.29.3"
        }
      ],
      "disposition": "PARTIALLY_SATISFIED",
      "evidence_pointers": [
        "db/75_ordem_compra_c3c_inactive_cutover.sql",
        "js/screens/ordem-compra-receipt-cutover.js",
        "js/screens/op-writes.js",
        "js/screens/fornecedor.js",
        "js/screens/op-persistir.js",
        "js/screens/op-recalculo.js",
        "tests/ordem-compra-c3c-inactive.integration.sql",
        "tests/ordem-compra-receipt-cutover.smoke.js",
        "tests/op-writes.smoke.js",
        "tests/fornecedor-screens.smoke.js",
        "tests/op-persistir.smoke.js",
        "tests/op-recalculo.smoke.js"
      ],
      "phase_owner": "C3C-B",
      "blocking_state": "NON_BLOCKING",
      "source_location": "docs/architecture/ORDEM_COMPRA_C3_TRACEABILITY.md:83",
      "review_status": "REVIEWED"
    },
    {
      "requirement_id": "OC-C3-COMPAT-001",
      "normative_sources": [
        {
          "path": "docs/architecture/ORDEM_COMPRA_LIFECYCLE_SPEC_PROPOSED.md",
          "anchor": "§R.29.1"
        }
      ],
      "disposition": "PARTIALLY_SATISFIED",
      "evidence_pointers": [
        "docs/architecture/ORDEM_COMPRA_C3C_B_PHASE_CONTRACT.md",
        "scripts/validate-spec-custody.mjs"
      ],
      "phase_owner": "C3C-B",
      "blocking_state": "NON_BLOCKING",
      "source_location": "docs/architecture/ORDEM_COMPRA_C3_TRACEABILITY.md:84",
      "review_status": "REVIEWED"
    },
    {
      "requirement_id": "OC-C3-NOUI-001",
      "normative_sources": [
        {
          "path": "docs/architecture/ORDEM_COMPRA_LIFECYCLE_SPEC_PROPOSED.md",
          "anchor": "§R.29.6"
        }
      ],
      "disposition": "PARTIALLY_SATISFIED",
      "evidence_pointers": [
        "js/router.js",
        "js/boot.js"
      ],
      "phase_owner": "C3C-B",
      "blocking_state": "NON_BLOCKING",
      "source_location": "docs/architecture/ORDEM_COMPRA_C3_TRACEABILITY.md:85",
      "review_status": "REVIEWED"
    },
    {
      "requirement_id": "OC-C3D-DEPLOY-001",
      "normative_sources": [
        {
          "path": "docs/architecture/ORDEM_COMPRA_LIFECYCLE_SPEC_PROPOSED.md",
          "anchor": "§R.29"
        }
      ],
      "disposition": "SATISFIED",
      "evidence_pointers": [
        "scripts/c3d/bootstrap-disposable-cluster.mjs",
        "tests/ordem-compra-c3d-deploy.smoke.js",
        "tests/ordem-compra-c3d-deploy.integration.sql",
        "db/75_ordem_compra_c3c_inactive_cutover.sql",
        "db/76_ordem_compra_c3c_b_db_prerequisites.sql"
      ],
      "phase_owner": "C3D",
      "blocking_state": "NON_BLOCKING",
      "source_location": "docs/architecture/ORDEM_COMPRA_C3_TRACEABILITY.md:86",
      "review_status": "REVIEWED"
    },
    {
      "requirement_id": "OC-C3D-FENCE-001",
      "normative_sources": [
        {
          "path": "docs/architecture/ORDEM_COMPRA_LIFECYCLE_SPEC_PROPOSED.md",
          "anchor": "§R.29.3"
        }
      ],
      "disposition": "SATISFIED",
      "evidence_pointers": [
        "db/75_ordem_compra_c3c_inactive_cutover.sql",
        "tests/ordem-compra-c3c-inactive.integration.sql",
        "tests/ordem-compra-c3d-fence.integration.sql"
      ],
      "phase_owner": "C3D",
      "blocking_state": "NON_BLOCKING",
      "source_location": "docs/architecture/ORDEM_COMPRA_C3_TRACEABILITY.md:87",
      "review_status": "REVIEWED"
    },
    {
      "requirement_id": "OC-C3D-ACL-001",
      "normative_sources": [
        {
          "path": "docs/architecture/PEDIDO_OP_SCHEMA_CONTRACT.md",
          "anchor": "13.15.2"
        }
      ],
      "disposition": "SATISFIED",
      "evidence_pointers": [
        "db/75_ordem_compra_c3c_inactive_cutover.sql",
        "tests/ordem-compra-c3d-acl.integration.sql",
        "tests/ordem-compra-c3c-inactive.integration.sql"
      ],
      "phase_owner": "C3D",
      "blocking_state": "NON_BLOCKING",
      "source_location": "docs/architecture/ORDEM_COMPRA_C3_TRACEABILITY.md:88",
      "review_status": "REVIEWED"
    },
    {
      "requirement_id": "OC-C3D-LOCK-001",
      "normative_sources": [
        {
          "path": "docs/architecture/ORDEM_COMPRA_LIFECYCLE_SPEC_PROPOSED.md",
          "anchor": "§R.29.5"
        }
      ],
      "disposition": "SATISFIED",
      "evidence_pointers": [
        "db/75_ordem_compra_c3c_inactive_cutover.sql",
        "tests/ordem-compra-c3d-lock-concurrency.mjs",
        "tests/ordem-compra-c3c-inactive-concurrency.mjs"
      ],
      "phase_owner": "C3D",
      "blocking_state": "NON_BLOCKING",
      "source_location": "docs/architecture/ORDEM_COMPRA_C3_TRACEABILITY.md:89",
      "review_status": "REVIEWED"
    },
    {
      "requirement_id": "OC-CUTOVER-001",
      "normative_sources": [
        {
          "path": "docs/architecture/ORDEM_COMPRA_LIFECYCLE_SPEC_PROPOSED.md",
          "anchor": "§R.29.5"
        }
      ],
      "disposition": "PLANNED",
      "evidence_pointers": [
        "docs/architecture/ORDEM_COMPRA_C3_TRACEABILITY.md"
      ],
      "phase_owner": "REAL_CUTOVER",
      "blocking_state": "BLOCKED",
      "source_location": "docs/architecture/ORDEM_COMPRA_C3_TRACEABILITY.md:90",
      "review_status": "REVIEWED"
    },
    {
      "requirement_id": "OC-CUTOVER-PONR-001",
      "normative_sources": [
        {
          "path": "docs/architecture/ORDEM_COMPRA_LIFECYCLE_SPEC_PROPOSED.md",
          "anchor": "§R.29.6"
        }
      ],
      "disposition": "PARTIALLY_SATISFIED",
      "evidence_pointers": [
        "db/75_ordem_compra_c3c_inactive_cutover.sql",
        "tests/ordem-compra-c3c-inactive.integration.sql"
      ],
      "phase_owner": "REAL_CUTOVER",
      "blocking_state": "NON_BLOCKING",
      "source_location": "docs/architecture/ORDEM_COMPRA_C3_TRACEABILITY.md:91",
      "review_status": "REVIEWED"
    },
    {
      "requirement_id": "OC-C4-ADMIN-001",
      "normative_sources": [
        {
          "path": "docs/architecture/ORDEM_COMPRA_LIFECYCLE_SPEC_PROPOSED.md",
          "anchor": "§R.29.6"
        }
      ],
      "disposition": "SATISFIED",
      "evidence_pointers": [
        "js/screens/ordem-compra-receipt-data.js",
        "js/screens/ordem-compra-receipt-render.js",
        "js/screens/ordem-compra-receipt-events.js",
        "js/screens/ordem-compra.js",
        "tests/ordem-compra-receipt-data.smoke.js",
        "tests/ordem-compra-receipt-render.smoke.js",
        "tests/ordem-compra-receipt-events.smoke.js",
        "tests/ordem-compra-receipt-routing.smoke.js",
        "scripts/validate-spec-custody.mjs"
      ],
      "phase_owner": "C4",
      "blocking_state": "NON_BLOCKING",
      "source_location": "docs/architecture/ORDEM_COMPRA_C3_TRACEABILITY.md:92",
      "review_status": "REVIEWED"
    },
    {
      "requirement_id": "OC-C4-SUPPLIER-001",
      "normative_sources": [
        {
          "path": "docs/architecture/ORDEM_COMPRA_LIFECYCLE_SPEC_PROPOSED.md",
          "anchor": "§R.29.6"
        }
      ],
      "disposition": "DEFERRED",
      "evidence_pointers": [
        "docs/architecture/ORDEM_COMPRA_C3_TRACEABILITY.md"
      ],
      "phase_owner": "C4",
      "blocking_state": "DEFERRED",
      "source_location": "docs/architecture/ORDEM_COMPRA_C3_TRACEABILITY.md:93",
      "review_status": "REVIEWED"
    },
    {
      "requirement_id": "OC-C5-EMISSION-001",
      "normative_sources": [
        {
          "path": "docs/architecture/ORDEM_COMPRA_LIFECYCLE_SPEC_PROPOSED.md",
          "anchor": "§R.24.10"
        }
      ],
      "disposition": "SATISFIED",
      "evidence_pointers": [
        "js/screens/ordem-compra-data.js",
        "js/screens/ordem-compra-render.js",
        "js/screens/ordem-compra-events.js",
        "tests/ordem-compra-emitir.smoke.js",
        "tests/ordem-compra.smoke.js",
        "scripts/validate-spec-custody.mjs"
      ],
      "phase_owner": "C5",
      "blocking_state": "NON_BLOCKING",
      "source_location": "docs/architecture/ORDEM_COMPRA_C3_TRACEABILITY.md:94",
      "review_status": "REVIEWED"
    }
  ]
}
